DOI,AUTHOR_NAME,AUTHOR_ORDER,AFFILIATION,TITLE,DATE,VOLUME,ISSUE,PAGES,KEYWORDS,ABSTRACT
10.1080/14413523.2021.1993645,Kevin Filo,first,"Department of Tourism, Sport and Hotel Management, Griffith University, Brisbane, Australia",An exploration of charity sport event donor perceptions of online peer-to-peer fundraising mechanisms,2022-3-25,NA,NA,1-24,"Marketing, Management Science and Operations Research, Organizational Behavior and Human Resource Management, Strategy and Management, Tourism, Leisure and Hospitality Management, Business and International Management","ABSTRACTThe employment of online peer-to-peer fundraising has become a critical aspect of the charity sport event experience. Charity sport event participants are encouraged and often requiredto fundraise as part of their involvement. Within this fundraising, participants increasingly use online peer-to-peer fundraising to solicit donations. The current research examines online peer-to-peer fundraising from the perspective of charity sport event donors. Guided by the diffusion of innovation theory and sociological approaches to technology, semi-structured interviews were conducted with individuals who had made an online donation in support of a charity sport event participant in the previous 12 months (N= 24). Four themes emerged from the interviews: technological detachment, technology eases pressure, saturated market, and cause integrity. These themes highlight concerns with the relative advantage inherent to online peer-to-peer fundraising as well as the importance of addressing technological adoption as a social process between users and technologies. The findings provide implications for event managers and charity managers to empower fundraisers to engage further with prospective donors through both online and in-person communication."
10.1080/14413523.2021.1993645,Nicholas Hookway,additional,"School of Social Sciences, University of Tasmania, Hobart, Australia",An exploration of charity sport event donor perceptions of online peer-to-peer fundraising mechanisms,2022-3-25,NA,NA,1-24,"Marketing, Management Science and Operations Research, Organizational Behavior and Human Resource Management, Strategy and Management, Tourism, Leisure and Hospitality Management, Business and International Management","ABSTRACTThe employment of online peer-to-peer fundraising has become a critical aspect of the charity sport event experience. Charity sport event participants are encouraged and often requiredto fundraise as part of their involvement. Within this fundraising, participants increasingly use online peer-to-peer fundraising to solicit donations. The current research examines online peer-to-peer fundraising from the perspective of charity sport event donors. Guided by the diffusion of innovation theory and sociological approaches to technology, semi-structured interviews were conducted with individuals who had made an online donation in support of a charity sport event participant in the previous 12 months (N= 24). Four themes emerged from the interviews: technological detachment, technology eases pressure, saturated market, and cause integrity. These themes highlight concerns with the relative advantage inherent to online peer-to-peer fundraising as well as the importance of addressing technological adoption as a social process between users and technologies. The findings provide implications for event managers and charity managers to empower fundraisers to engage further with prospective donors through both online and in-person communication."
10.1080/14413523.2021.1993645,Matthew Wade,additional,"Department of Social Sciences, LaTrobe University",An exploration of charity sport event donor perceptions of online peer-to-peer fundraising mechanisms,2022-3-25,NA,NA,1-24,"Marketing, Management Science and Operations Research, Organizational Behavior and Human Resource Management, Strategy and Management, Tourism, Leisure and Hospitality Management, Business and International Management","ABSTRACTThe employment of online peer-to-peer fundraising has become a critical aspect of the charity sport event experience. Charity sport event participants are encouraged and often requiredto fundraise as part of their involvement. Within this fundraising, participants increasingly use online peer-to-peer fundraising to solicit donations. The current research examines online peer-to-peer fundraising from the perspective of charity sport event donors. Guided by the diffusion of innovation theory and sociological approaches to technology, semi-structured interviews were conducted with individuals who had made an online donation in support of a charity sport event participant in the previous 12 months (N= 24). Four themes emerged from the interviews: technological detachment, technology eases pressure, saturated market, and cause integrity. These themes highlight concerns with the relative advantage inherent to online peer-to-peer fundraising as well as the importance of addressing technological adoption as a social process between users and technologies. The findings provide implications for event managers and charity managers to empower fundraisers to engage further with prospective donors through both online and in-person communication."
10.1080/14413523.2021.1993645,Catherine Palmer,additional,"Department of Social Sciences, Northumbria University, UK",An exploration of charity sport event donor perceptions of online peer-to-peer fundraising mechanisms,2022-3-25,NA,NA,1-24,"Marketing, Management Science and Operations Research, Organizational Behavior and Human Resource Management, Strategy and Management, Tourism, Leisure and Hospitality Management, Business and International Management","ABSTRACTThe employment of online peer-to-peer fundraising has become a critical aspect of the charity sport event experience. Charity sport event participants are encouraged and often requiredto fundraise as part of their involvement. Within this fundraising, participants increasingly use online peer-to-peer fundraising to solicit donations. The current research examines online peer-to-peer fundraising from the perspective of charity sport event donors. Guided by the diffusion of innovation theory and sociological approaches to technology, semi-structured interviews were conducted with individuals who had made an online donation in support of a charity sport event participant in the previous 12 months (N= 24). Four themes emerged from the interviews: technological detachment, technology eases pressure, saturated market, and cause integrity. These themes highlight concerns with the relative advantage inherent to online peer-to-peer fundraising as well as the importance of addressing technological adoption as a social process between users and technologies. The findings provide implications for event managers and charity managers to empower fundraisers to engage further with prospective donors through both online and in-person communication."
10.1016/j.smr.2010.02.001,Patrick Bouchet,first,"University of Burgundy, 	France",Segmenting sport spectators: Construction and preliminary validation of the Sporting Event Experience Search (SEES) scale,2011-1-1,14,1,42-53,"Marketing, Management Science and Operations Research, Organizational Behavior and Human Resource Management, Strategy and Management, Tourism, Leisure and Hospitality Management, Business and International Management","AbstractThis study's goal was to create and test a tool for identifying different types of sport spectators. Based on four types of sporting-event consumers – aesthete, interactive, supporter, and opportunist – we developed the Sporting Event Experience Search Scale (SEES). We conducted an empirical investigation involving two sporting events with both live and mediated types of attendance. Although the first validation step failed to support the four-type structure for the mediated context, the scale appeared to be relevant in a live-attendance context. The SEES scale should therefore allow sporting-event managers to analyse the nature and then the expectations of sport spectators by identifying which sporting event consumption type is dominant. This study consequently proposes four marketing axes corresponding to the four consumption patterns."
10.1016/j.smr.2010.02.001,Guillaume Bodet,additional,"Institute of Sport & Leisure Policy, SSES, University of Loughborough, LE11 3TU, UK",Segmenting sport spectators: Construction and preliminary validation of the Sporting Event Experience Search (SEES) scale,2011-1-1,14,1,42-53,"Marketing, Management Science and Operations Research, Organizational Behavior and Human Resource Management, Strategy and Management, Tourism, Leisure and Hospitality Management, Business and International Management","AbstractThis study's goal was to create and test a tool for identifying different types of sport spectators. Based on four types of sporting-event consumers – aesthete, interactive, supporter, and opportunist – we developed the Sporting Event Experience Search Scale (SEES). We conducted an empirical investigation involving two sporting events with both live and mediated types of attendance. Although the first validation step failed to support the four-type structure for the mediated context, the scale appeared to be relevant in a live-attendance context. The SEES scale should therefore allow sporting-event managers to analyse the nature and then the expectations of sport spectators by identifying which sporting event consumption type is dominant. This study consequently proposes four marketing axes corresponding to the four consumption patterns."
10.1016/j.smr.2010.02.001,Iouri Bernache-Assollant,additional,"University of Franche-Comté, France",Segmenting sport spectators: Construction and preliminary validation of the Sporting Event Experience Search (SEES) scale,2011-1-1,14,1,42-53,"Marketing, Management Science and Operations Research, Organizational Behavior and Human Resource Management, Strategy and Management, Tourism, Leisure and Hospitality Management, Business and International Management","AbstractThis study's goal was to create and test a tool for identifying different types of sport spectators. Based on four types of sporting-event consumers – aesthete, interactive, supporter, and opportunist – we developed the Sporting Event Experience Search Scale (SEES). We conducted an empirical investigation involving two sporting events with both live and mediated types of attendance. Although the first validation step failed to support the four-type structure for the mediated context, the scale appeared to be relevant in a live-attendance context. The SEES scale should therefore allow sporting-event managers to analyse the nature and then the expectations of sport spectators by identifying which sporting event consumption type is dominant. This study consequently proposes four marketing axes corresponding to the four consumption patterns."
10.1016/j.smr.2010.02.001,Faycel Kada,additional,"University of Burgundy, 	France",Segmenting sport spectators: Construction and preliminary validation of the Sporting Event Experience Search (SEES) scale,2011-1-1,14,1,42-53,"Marketing, Management Science and Operations Research, Organizational Behavior and Human Resource Management, Strategy and Management, Tourism, Leisure and Hospitality Management, Business and International Management","AbstractThis study's goal was to create and test a tool for identifying different types of sport spectators. Based on four types of sporting-event consumers – aesthete, interactive, supporter, and opportunist – we developed the Sporting Event Experience Search Scale (SEES). We conducted an empirical investigation involving two sporting events with both live and mediated types of attendance. Although the first validation step failed to support the four-type structure for the mediated context, the scale appeared to be relevant in a live-attendance context. The SEES scale should therefore allow sporting-event managers to analyse the nature and then the expectations of sport spectators by identifying which sporting event consumption type is dominant. This study consequently proposes four marketing axes corresponding to the four consumption patterns."
10.1016/j.smr.2011.05.004,Sarah Gee,first,"School of Sport and Exercise, Massey University, New Zealand",Sport Public Relations and Communication,2011-10-1,14,4,462-463,"Marketing, Management Science and Operations Research, Organizational Behavior and Human Resource Management, Strategy and Management, Tourism, Leisure and Hospitality Management, Business and International Management",NA
10.1016/j.smr.2011.05.004,M. Hopwood,additional,"1st edition Butterworth-Heinemann, Elsevier Ltd., The Boulevard, Langford Lane, Kidlington, Oxford OX5 1GB, UK (2010). 271 pp., ISBN: 9781856176156",Sport Public Relations and Communication,2011-10-1,14,4,462-463,"Marketing, Management Science and Operations Research, Organizational Behavior and Human Resource Management, Strategy and Management, Tourism, Leisure and Hospitality Management, Business and International Management",NA
10.1016/j.smr.2011.05.004,P. Kitchin,additional,"1st edition Butterworth-Heinemann, Elsevier Ltd., The Boulevard, Langford Lane, Kidlington, Oxford OX5 1GB, UK (2010). 271 pp., ISBN: 9781856176156",Sport Public Relations and Communication,2011-10-1,14,4,462-463,"Marketing, Management Science and Operations Research, Organizational Behavior and Human Resource Management, Strategy and Management, Tourism, Leisure and Hospitality Management, Business and International Management",NA
10.1016/j.smr.2011.05.004,J. Skinner,additional,"1st edition Butterworth-Heinemann, Elsevier Ltd., The Boulevard, Langford Lane, Kidlington, Oxford OX5 1GB, UK (2010). 271 pp., ISBN: 9781856176156",Sport Public Relations and Communication,2011-10-1,14,4,462-463,"Marketing, Management Science and Operations Research, Organizational Behavior and Human Resource Management, Strategy and Management, Tourism, Leisure and Hospitality Management, Business and International Management",NA
10.1016/j.smr.2020.04.006,Ashlee Morgan,first,"School of Business and Law, Edith Cowan University, Perth, Australia",Sport event sponsorship management from the sponsee’s perspective,2020-12-1,23,5,838-851,"Marketing, Management Science and Operations Research, Organizational Behavior and Human Resource Management, Strategy and Management, Tourism, Leisure and Hospitality Management, Business and International Management",Highlights• Structural and relational considerations are critical for sponsorship management• Brand and strategic compatibility are valued by the sponsee• Trustworthy relationships are instrumental in managing sponsors• Staff turnover impacts asset-specific knowledge and inter-firm social bonds
10.1016/j.smr.2020.04.006,Tracy Taylor,additional,"Victoria University, Australia",Sport event sponsorship management from the sponsee’s perspective,2020-12-1,23,5,838-851,"Marketing, Management Science and Operations Research, Organizational Behavior and Human Resource Management, Strategy and Management, Tourism, Leisure and Hospitality Management, Business and International Management",Highlights• Structural and relational considerations are critical for sponsorship management• Brand and strategic compatibility are valued by the sponsee• Trustworthy relationships are instrumental in managing sponsors• Staff turnover impacts asset-specific knowledge and inter-firm social bonds
10.1016/j.smr.2020.04.006,Daryl Adair,additional,"UTS Business School, University of Technology Sydney, Australia",Sport event sponsorship management from the sponsee’s perspective,2020-12-1,23,5,838-851,"Marketing, Management Science and Operations Research, Organizational Behavior and Human Resource Management, Strategy and Management, Tourism, Leisure and Hospitality Management, Business and International Management",Highlights• Structural and relational considerations are critical for sponsorship management• Brand and strategic compatibility are valued by the sponsee• Trustworthy relationships are instrumental in managing sponsors• Staff turnover impacts asset-specific knowledge and inter-firm social bonds
10.1016/j.smr.2011.08.005,Milena M. Parent,first,"University of Ottawa, Faculty of Health Sciences, School of Human Kinetics, 125 University St., Ottawa, ON, K1N 6N5, Canada",Brand creation in international recurring sports events,2012-4-1,15,2,145-159,"Marketing, Management Science and Operations Research, Organizational Behavior and Human Resource Management, Strategy and Management, Tourism, Leisure and Hospitality Management, Business and International Management","Highlights► Examine the brand creation process in international recurring sports events. ► Comparative case study of Norwegian and Canadian cross-country ski events. ► Similarities: leaders’ skills/actions, event experience, institutional experiences. ► Differences: branding/marketing efforts, event history and impact. ► Findings extend Parent and Séguin's (2008) one-off event brand creation model."
10.1016/j.smr.2011.08.005,Line Eskerud,additional,"Norwegian School of Sport Sciences, Department of Cultural and Social Studies, PO Box 4014, Ullevål Stadion, Sognsveien 220, 0806 Oslo, Norway",Brand creation in international recurring sports events,2012-4-1,15,2,145-159,"Marketing, Management Science and Operations Research, Organizational Behavior and Human Resource Management, Strategy and Management, Tourism, Leisure and Hospitality Management, Business and International Management","Highlights► Examine the brand creation process in international recurring sports events. ► Comparative case study of Norwegian and Canadian cross-country ski events. ► Similarities: leaders’ skills/actions, event experience, institutional experiences. ► Differences: branding/marketing efforts, event history and impact. ► Findings extend Parent and Séguin's (2008) one-off event brand creation model."
10.1016/j.smr.2011.08.005,Dag Vidar Hanstad,additional,"Norwegian School of Sport Sciences, Department of Cultural and Social Studies, PO Box 4014, Ullevål Stadion, Sognsveien 220, 0806 Oslo, Norway",Brand creation in international recurring sports events,2012-4-1,15,2,145-159,"Marketing, Management Science and Operations Research, Organizational Behavior and Human Resource Management, Strategy and Management, Tourism, Leisure and Hospitality Management, Business and International Management","Highlights► Examine the brand creation process in international recurring sports events. ► Comparative case study of Norwegian and Canadian cross-country ski events. ► Similarities: leaders’ skills/actions, event experience, institutional experiences. ► Differences: branding/marketing efforts, event history and impact. ► Findings extend Parent and Séguin's (2008) one-off event brand creation model."
10.1016/j.smr.2020.02.002,Graham Cuskelly,first,"Griffith Business School, Griffith University, Business 2 building (G27) , Room 2.06 , Australia",Volunteer selection at a major sport event: A strategic Human Resource Management approach,2021-1-1,24,1,116-133,"Marketing, Management Science and Operations Research, Organizational Behavior and Human Resource Management, Strategy and Management, Tourism, Leisure and Hospitality Management, Business and International Management","ABSTRACTVolunteers have long been regarded as an essential part of the staging major sport events both to encourage community participation and to contain labour costs. Major sport events often attract a large pool of applicants which exceeds the number of volunteer positions available. Selecting the best qualified applicants for available positions requires volunteer selection processes that are fair, effective, and efficient from both the volunteer and event organising committee perspectives. Using a Strategic Human Resource Management (SHRM) approach, the authors investigated factors that predicted the selection of applicants interviewed for volunteer positions from the perspective of a major sport event organiser. Using deidentified data from all volunteer applications (n = 53,234) for the 2018 Gold Coast Commonwealth Games, the authors identified a number of factors that predicted the likelihood of an applicant being selected for an interview for a volunteer position. SHRM principles were applied to volunteer selection decisions but in a limited way. The authors found some evidence of links between volunteer selection decisions and the overarching strategies of the Games. However, these decisions prioritised the short-term goal of filling volunteer positions to stage a successful Games rather than longer-term strategic goals. The research contributes to better understanding links between major event HRM strategies and volunteer selection, identifying factors which predict volunteer selection, and possible limitations in the application of volunteer database management systems from a SHRM perspective."
10.1016/j.smr.2020.02.002,Liz Fredline,additional,"Griffith Business School, Griffith University, Business 2 building (G27) , Room 2.06 , Australia",Volunteer selection at a major sport event: A strategic Human Resource Management approach,2021-1-1,24,1,116-133,"Marketing, Management Science and Operations Research, Organizational Behavior and Human Resource Management, Strategy and Management, Tourism, Leisure and Hospitality Management, Business and International Management","ABSTRACTVolunteers have long been regarded as an essential part of the staging major sport events both to encourage community participation and to contain labour costs. Major sport events often attract a large pool of applicants which exceeds the number of volunteer positions available. Selecting the best qualified applicants for available positions requires volunteer selection processes that are fair, effective, and efficient from both the volunteer and event organising committee perspectives. Using a Strategic Human Resource Management (SHRM) approach, the authors investigated factors that predicted the selection of applicants interviewed for volunteer positions from the perspective of a major sport event organiser. Using deidentified data from all volunteer applications (n = 53,234) for the 2018 Gold Coast Commonwealth Games, the authors identified a number of factors that predicted the likelihood of an applicant being selected for an interview for a volunteer position. SHRM principles were applied to volunteer selection decisions but in a limited way. The authors found some evidence of links between volunteer selection decisions and the overarching strategies of the Games. However, these decisions prioritised the short-term goal of filling volunteer positions to stage a successful Games rather than longer-term strategic goals. The research contributes to better understanding links between major event HRM strategies and volunteer selection, identifying factors which predict volunteer selection, and possible limitations in the application of volunteer database management systems from a SHRM perspective."
10.1016/j.smr.2020.02.002,Eunjung Kim,additional,"Edith Cowan University, Australia",Volunteer selection at a major sport event: A strategic Human Resource Management approach,2021-1-1,24,1,116-133,"Marketing, Management Science and Operations Research, Organizational Behavior and Human Resource Management, Strategy and Management, Tourism, Leisure and Hospitality Management, Business and International Management","ABSTRACTVolunteers have long been regarded as an essential part of the staging major sport events both to encourage community participation and to contain labour costs. Major sport events often attract a large pool of applicants which exceeds the number of volunteer positions available. Selecting the best qualified applicants for available positions requires volunteer selection processes that are fair, effective, and efficient from both the volunteer and event organising committee perspectives. Using a Strategic Human Resource Management (SHRM) approach, the authors investigated factors that predicted the selection of applicants interviewed for volunteer positions from the perspective of a major sport event organiser. Using deidentified data from all volunteer applications (n = 53,234) for the 2018 Gold Coast Commonwealth Games, the authors identified a number of factors that predicted the likelihood of an applicant being selected for an interview for a volunteer position. SHRM principles were applied to volunteer selection decisions but in a limited way. The authors found some evidence of links between volunteer selection decisions and the overarching strategies of the Games. However, these decisions prioritised the short-term goal of filling volunteer positions to stage a successful Games rather than longer-term strategic goals. The research contributes to better understanding links between major event HRM strategies and volunteer selection, identifying factors which predict volunteer selection, and possible limitations in the application of volunteer database management systems from a SHRM perspective."
